[{"id":1,"slug":"tripoli","name_ar":"طرابلس","name_en":"Tripoli","type":"city"},{"id":2,"slug":"benghazi","name_ar":"بنغازي","name_en":"Benghazi","type":"city"},{"id":3,"slug":"misrata","name_ar":"مصراته","name_en":"Misrata","type":"city"},{"id":4,"slug":"zawiya","name_ar":"الزاوية","name_en":"Zawiya","type":"city"},{"id":5,"slug":"zliten","name_ar":"زليتن","name_en":"Zliten","type":"city"},{"id":6,"slug":"al-bayda","name_ar":"البيضا","name_en":"Al Bayda","type":"city"},{"id":7,"slug":"ajdabiya","name_ar":"اجدابيا","name_en":"Ajdabiya","type":"city"},{"id":8,"slug":"gharyan","name_ar":"غريان","name_en":"Gharyan","type":"city"},{"id":9,"slug":"tobruk","name_ar":"طبرق","name_en":"Tobruk","type":"city"},{"id":10,"slug":"sabratha","name_ar":"صبراته","name_en":"Sabratha","type":"city"},{"id":11,"slug":"sabha","name_ar":"سبها","name_en":"Sabha","type":"city"},{"id":12,"slug":"khoms","name_ar":"الخمس","name_en":"Khoms","type":"city"},{"id":13,"slug":"derna","name_ar":"درنه","name_en":"Derna","type":"city"},{"id":14,"slug":"sirte","name_ar":"سرت","name_en":"Sirte","type":"city"},{"id":15,"slug":"al-jumayl","name_ar":"الجميل","name_en":"Al Jumayl","type":"city"},{"id":16,"slug":"kufra","name_ar":"الكفره","name_en":"Kufra","type":"city"},{"id":17,"slug":"al-marj","name_ar":"المرج","name_en":"Al Marj","type":"city"},{"id":18,"slug":"yafran","name_ar":"يفرن","name_en":"Yafran","type":"city"},{"id":19,"slug":"tarhuna","name_ar":"ترهونة","name_en":"Tarhuna","type":"city"},{"id":20,"slug":"msallata","name_ar":"مسلاته","name_en":"Msallata","type":"city"},{"id":21,"slug":"bani-walid","name_ar":"بني وليد","name_en":"Bani Walid","type":"city"},{"id":22,"slug":"sorman","name_ar":"صرمان","name_en":"Sorman","type":"city"},{"id":23,"slug":"riqdalin","name_ar":"رقدالين","name_en":"Riqdalin","type":"city"},{"id":24,"slug":"zintan","name_ar":"الزنتان","name_en":"Zintan","type":"city"},{"id":25,"slug":"zuwara","name_ar":"زواره","name_en":"Zuwara","type":"city"},{"id":26,"slug":"shahat","name_ar":"شحات","name_en":"Shahat","type":"city"},{"id":27,"slug":"ubari","name_ar":"اوباري","name_en":"Ubari","type":"city"},{"id":28,"slug":"al-abyar","name_ar":"الابيار","name_en":"Al Abyar","type":"city"},{"id":29,"slug":"zaltan","name_ar":"زلطن","name_en":"Zaltan","type":"city"},{"id":30,"slug":"al-qubbah","name_ar":"القبه","name_en":"Al Qubbah","type":"city"},{"id":31,"slug":"tawergha","name_ar":"تاورغا","name_en":"Tawergha","type":"city"},{"id":32,"slug":"al-maya","name_ar":"المايه","name_en":"Al Maya","type":"city"},{"id":33,"slug":"murzuq","name_ar":"مرزق","name_en":"Murzuq","type":"city"},{"id":34,"slug":"brega","name_ar":"البريقه","name_en":"Brega","type":"city"},{"id":35,"slug":"hun","name_ar":"هون","name_en":"Hun","type":"city"},{"id":36,"slug":"jalu","name_ar":"جالو","name_en":"Jalu","type":"city"},{"id":37,"slug":"nalut","name_ar":"نالوت","name_en":"Nalut","type":"city"},{"id":38,"slug":"suluq","name_ar":"سلوق","name_en":"Suluq","type":"city"},{"id":39,"slug":"mizda","name_ar":"مزده","name_en":"Mizda","type":"city"},{"id":40,"slug":"ras-lanuf","name_ar":"راس لانوف","name_en":"Ras Lanuf","type":"city"},{"id":41,"slug":"al-urban","name_ar":"العربان","name_en":"Al Urban","type":"city"},{"id":42,"slug":"waddan","name_ar":"ودان","name_en":"Waddan","type":"city"},{"id":43,"slug":"al-ajaylat","name_ar":"العجيلات","name_en":"Al Ajaylat","type":"city"},{"id":44,"slug":"tukrah","name_ar":"توكره","name_en":"Tukrah","type":"city"},{"id":45,"slug":"brak","name_ar":"براك","name_en":"Brak","type":"city"},{"id":46,"slug":"ghadames","name_ar":"غدامس","name_en":"Ghadames","type":"city"},{"id":47,"slug":"ghat","name_ar":"غات","name_en":"Ghat","type":"city"},{"id":48,"slug":"awjila","name_ar":"اوجله","name_en":"Awjila","type":"city"},{"id":49,"slug":"sousa","name_ar":"سوسه","name_en":"Sousa","type":"city"},{"id":50,"slug":"rabiana","name_ar":"ربيانه","name_en":"Rabiana","type":"city"}]